<?xml version="1.0" encoding="UTF-8" ?>
<!DOCTYPE helpnavigation SYSTEM "helpdoc.dtd">
<helpnavigation>
   <title id="0" name="General I-Learn">
      <document id="0-1" ref="http://byui.brainhoney.com/resource/14853/Web/help/Announcements.vhtml" title="Announcements" />
   </title>
   <title id="1" name="Student Dashboard">
      <document id="1-1" ref="http://byui.brainhoney.com/resource/14853/Web/help/GradebookActivity.vhtml" title="Gradebook Activity" />
      <document id="1-2" ref="http://byui.brainhoney.com/resource/14853/Web/help/CourseListStudent.vhtml" title="Course List" />
      <document id="1-3" ref="http://byui.brainhoney.com/resource/14853/Web/help/DueSoon.vhtml" title="Due Soon" />
      <document id="1-4" ref="http://byui.brainhoney.com/resource/14853/Web/help/Transcript.vhtml" title="Transcript">
         <document id="1-4-1" ref="http://byui.brainhoney.com/resource/14853/Web/help/Default.vhtml" title="Something">
            <document id="1-4-1-1" ref="http://byui.brainhoney.com/resource/14853/web/component/calendar/mastercal.vhtml" title="calendar">
               <document id="1-4-1-1-1" ref="http://byui.brainhoney.com/resource/14853/web/component/eyelearn/eyelearn.vhtml" title="calendar" />
            </document>
         </document>
      </document>
   </title>
   <title id="2" name="Teacher Dashboard">
      <document id="2-1" ref="http://byui.brainhoney.com/resource/14853/Web/help/CourseListTeacher.vhtml" title="Course List" />
      <document id="2-2" ref="http://byui.brainhoney.com/resource/14853/Web/help/GradebookQuickview.vhtml" title="Gradebook Quickview" />
   </title>
</helpnavigation>
